{
  "quotes": [
    {
      "quote_id": "Q001",
      "source_id": "001",
      "source_title": "Agile Governance: Examining the Impact of DevOps on PMO",
      "authors": ["Peerzada, I."],
      "year": 2025,
      "page": 1,
      "quote": "Agile governance emerges as a strategic necessity for balancing control and agility in DevOps environments.",
      "context": "Introduction discusses the tension between traditional governance and DevOps agility, positioning agile governance as the solution.",
      "relevance": "Directly addresses the core research question of balancing compliance control with agile flow in DevOps contexts.",
      "keywords_matched": ["Agile Governance", "DevOps"],
      "filename": "Peerzada_2025_Agile_Governance.pdf"
    },
    {
      "quote_id": "Q002",
      "source_id": "001",
      "source_title": "Agile Governance: Examining the Impact of DevOps on PMO",
      "authors": ["Peerzada, I."],
      "year": 2025,
      "page": 1,
      "quote": "Traditional PMOs become bottlenecks in agile, DevOps-driven environments that prioritize rapid iteration and continuous delivery.",
      "context": "Examines how conventional governance structures create friction with DevOps practices.",
      "relevance": "Identifies the core problem that lean governance must solve - avoiding governance bottlenecks that slow DevOps velocity.",
      "keywords_matched": ["DevOps", "Continuous Delivery"],
      "filename": "Peerzada_2025_Agile_Governance.pdf"
    },
    {
      "quote_id": "Q003",
      "source_id": "001",
      "source_title": "Agile Governance: Examining the Impact of DevOps on PMO",
      "authors": ["Peerzada, I."],
      "year": 2025,
      "page": 2,
      "quote": "PMOs must transform from gatekeepers to enablers, providing guardrails rather than gates.",
      "context": "Describes the fundamental shift required in governance models for DevOps adoption.",
      "relevance": "Defines the guardrails concept central to lean governance - enabling safe autonomy rather than blocking progress.",
      "keywords_matched": ["Guardrails"],
      "filename": "Peerzada_2025_Agile_Governance.pdf"
    },
    {
      "quote_id": "Q004",
      "source_id": "001",
      "source_title": "Agile Governance: Examining the Impact of DevOps on PMO",
      "authors": ["Peerzada, I."],
      "year": 2025,
      "page": 5,
      "quote": "Automation emerges as critical, enabling continuous compliance monitoring without manual intervention or velocity degradation.",
      "context": "Discusses how automation enables governance without slowing delivery pipelines.",
      "relevance": "Demonstrates how continuous compliance can be achieved through automation, maintaining both control and flow.",
      "keywords_matched": ["Continuous Compliance", "Automation"],
      "filename": "Peerzada_2025_Agile_Governance.pdf"
    },
    {
      "quote_id": "Q005",
      "source_id": "001",
      "source_title": "Agile Governance: Examining the Impact of DevOps on PMO",
      "authors": ["Peerzada, I."],
      "year": 2025,
      "page": 7,
      "quote": "CI/CD pipelines integrate automated security checks, policy validation, and compliance gates without disrupting developer workflows.",
      "context": "Explains how governance controls are embedded directly into CI/CD automation.",
      "relevance": "Shows practical implementation of continuous compliance through automated guardrails in deployment pipelines.",
      "keywords_matched": ["CI/CD", "Compliance automation"],
      "filename": "Peerzada_2025_Agile_Governance.pdf"
    },
    {
      "quote_id": "Q006",
      "source_id": "001",
      "source_title": "Agile Governance: Examining the Impact of DevOps on PMO",
      "authors": ["Peerzada, I."],
      "year": 2025,
      "page": 8,
      "quote": "Lightweight governance frameworks reduce overhead while maintaining necessary controls through automated policy enforcement.",
      "context": "Discusses characteristics of effective agile governance models.",
      "relevance": "Defines lean governance approach - minimal overhead with automated control mechanisms.",
      "keywords_matched": ["Lean Governance", "Governance automation"],
      "filename": "Peerzada_2025_Agile_Governance.pdf"
    },
    {
      "quote_id": "Q007",
      "source_id": "001",
      "source_title": "Agile Governance: Examining the Impact of DevOps on PMO",
      "authors": ["Peerzada, I."],
      "year": 2025,
      "page": 10,
      "quote": "Decentralized decision-making with centralized visibility enables team autonomy while ensuring organizational oversight and compliance.",
      "context": "Examines governance structures that balance autonomy and control.",
      "relevance": "Describes governance architecture for sandbox environments - local autonomy with central monitoring.",
      "keywords_matched": ["Agile Governance"],
      "filename": "Peerzada_2025_Agile_Governance.pdf"
    },
    {
      "quote_id": "Q008",
      "source_id": "001",
      "source_title": "Agile Governance: Examining the Impact of DevOps on PMO",
      "authors": ["Peerzada, I."],
      "year": 2025,
      "page": 11,
      "quote": "Real-time audit trails through automated logging provide compliance evidence without manual reporting burden.",
      "context": "Discusses automated compliance documentation mechanisms.",
      "relevance": "Addresses audit trail requirements for compliance without creating administrative overhead that slows teams.",
      "keywords_matched": ["Audit Trail", "Compliance automation"],
      "filename": "Peerzada_2025_Agile_Governance.pdf"
    },
    {
      "quote_id": "Q009",
      "source_id": "001",
      "source_title": "Agile Governance: Examining the Impact of DevOps on PMO",
      "authors": ["Peerzada, I."],
      "year": 2025,
      "page": 12,
      "quote": "Policy-as-code enables version-controlled, testable governance rules integrated directly into development workflows.",
      "context": "Explores how governance policies can be codified and automated.",
      "relevance": "Shows how governance rules become executable code in CI/CD pipelines, enabling continuous compliance.",
      "keywords_matched": ["DevOps", "Governance automation"],
      "filename": "Peerzada_2025_Agile_Governance.pdf"
    },
    {
      "quote_id": "Q010",
      "source_id": "001",
      "source_title": "Agile Governance: Examining the Impact of DevOps on PMO",
      "authors": ["Peerzada, I."],
      "year": 2025,
      "page": 14,
      "quote": "Cultural transformation requires leadership support, cross-functional collaboration, and continuous learning to embed governance into team practices.",
      "context": "Discusses organizational change management for agile governance adoption.",
      "relevance": "Highlights cultural requirements for successful lean governance implementation beyond technical solutions.",
      "keywords_matched": ["Agile Governance"],
      "filename": "Peerzada_2025_Agile_Governance.pdf"
    },
    {
      "quote_id": "Q011",
      "source_id": "001",
      "source_title": "Agile Governance: Examining the Impact of DevOps on PMO",
      "authors": ["Peerzada, I."],
      "year": 2025,
      "page": 15,
      "quote": "Self-service platforms with embedded guardrails enable teams to provision resources while maintaining security and compliance boundaries.",
      "context": "Examines infrastructure provisioning models that balance autonomy and control.",
      "relevance": "Describes ideal model for DevOps sandboxes - self-service within automated compliance boundaries.",
      "keywords_matched": ["Guardrails", "Sandbox"],
      "filename": "Peerzada_2025_Agile_Governance.pdf"
    },
    {
      "quote_id": "Q012",
      "source_id": "001",
      "source_title": "Agile Governance: Examining the Impact of DevOps on PMO",
      "authors": ["Peerzada, I."],
      "year": 2025,
      "page": 16,
      "quote": "Dynamic Capabilities Framework enables PMOs to sense market shifts, seize opportunities, and reconfigure organizational resources.",
      "context": "Introduces theoretical framework for adaptive governance in DevOps contexts.",
      "relevance": "Provides theoretical foundation for governance models that adapt dynamically to changing requirements.",
      "keywords_matched": ["Agile Governance", "DevOps"],
      "filename": "Peerzada_2025_Agile_Governance.pdf"
    },
    {
      "quote_id": "Q013",
      "source_id": "001",
      "source_title": "Agile Governance: Examining the Impact of DevOps on PMO",
      "authors": ["Peerzada, I."],
      "year": 2025,
      "page": 17,
      "quote": "Automated compliance monitoring reduces manual overhead while ensuring continuous adherence to security and regulatory requirements.",
      "context": "Discusses automation benefits for compliance management.",
      "relevance": "Demonstrates how automation eliminates compliance-agility tradeoff by enabling continuous verification.",
      "keywords_matched": ["Continuous Compliance", "Automation"],
      "filename": "Peerzada_2025_Agile_Governance.pdf"
    },
    {
      "quote_id": "Q014",
      "source_id": "001",
      "source_title": "Agile Governance: Examining the Impact of DevOps on PMO",
      "authors": ["Peerzada, I."],
      "year": 2025,
      "page": 18,
      "quote": "Agile DevOps Reference Model combines governance lens, workflow tools, and practices for seamless technical-governance alignment.",
      "context": "Introduces comprehensive framework for integrating governance with DevOps practices.",
      "relevance": "Provides structured model for implementing governance that supports rather than blocks DevOps workflows.",
      "keywords_matched": ["Agile Governance", "DevOps"],
      "filename": "Peerzada_2025_Agile_Governance.pdf"
    },
    {
      "quote_id": "Q015",
      "source_id": "001",
      "source_title": "Agile Governance: Examining the Impact of DevOps on PMO",